{"artifact_type":"phase3_guarded_label_unlock_receipt","attempt_id":"ssq-2025099-M1-attempt-01","experiment_id":"ssq-2025099-M1","forecast_path":"runs/forecasts/ssq/2025099/M1.json","forecast_sha256":"b5afa7fd5e9c434add7d3290603006d57488344bc11dc25f58dd1eafda360943","game":"ssq","guard_validation":{"forecast_current_hash_matches_lock":true,"forecast_persisted":true,"label_read_after_all_guards":true,"latest_ledger_state_is_matching_lock":true,"release_experiment_attempt_target_model_match":true},"label_sha256":"a8c1167784cc7bd88089cdcd6fe3778a5097799350a62e74e3d04dee119a12a9","label_store_identity":"phase3-label-store-v1:f2e34a88fbd43a378d7fb6255d39deee1354216b918934f355a06ef986be60c1","label_unlocked_at":"2026-08-09T06:00:43.591883Z","model_id":"M1","read_ordinal":326,"release_id":"P3-R04-33d2810-20260809-I01","run_id":"P3-R04-33d2810-20260809-I01-W08","schema_version":"3.0.0","target_issue":"2025099"}
