{"artifact_type":"phase3_guarded_label_unlock_receipt","attempt_id":"ssq-2025096-M0-attempt-01","experiment_id":"ssq-2025096-M0","forecast_path":"runs/forecasts/ssq/2025096/M0.json","forecast_sha256":"e68fb9883999b329683a96caf97803a02f6a9aaa765109d3e40c677d07bf077a","game":"ssq","guard_validation":{"forecast_current_hash_matches_lock":true,"forecast_persisted":true,"label_read_after_all_guards":true,"latest_ledger_state_is_matching_lock":true,"release_experiment_attempt_target_model_match":true},"label_sha256":"be0477c2b8c5de123ab0f7d639d7c8a4a1fe19e5b8e872819be4938f513cb229","label_store_identity":"phase3-label-store-v1:f2e34a88fbd43a378d7fb6255d39deee1354216b918934f355a06ef986be60c1","label_unlocked_at":"2026-08-10T02:41:07.442060Z","model_id":"M0","read_ordinal":295,"release_id":"P3-R07-2c0fa97-20260810-I01","run_id":"P3-R07-2c0fa97-20260810-I01-W08","schema_version":"3.0.0","target_issue":"2025096"}
