{"artifact_type":"phase3_guarded_label_unlock_receipt","attempt_id":"ssq-2025129-M0-attempt-01","experiment_id":"ssq-2025129-M0","forecast_path":"runs/forecasts/ssq/2025129/M0.json","forecast_sha256":"ded198640d0794f64236e4867ec7ce494d895612c6060a6b8a451607575fe07d","game":"ssq","guard_validation":{"forecast_current_hash_matches_lock":true,"forecast_persisted":true,"label_read_after_all_guards":true,"latest_ledger_state_is_matching_lock":true,"release_experiment_attempt_target_model_match":true},"label_sha256":"30cc676cc3eca1a1155f1b09cac8d23d7ca059d7738cd2a106e2d7d79b0d940f","label_store_identity":"phase3-label-store-v1:f2e34a88fbd43a378d7fb6255d39deee1354216b918934f355a06ef986be60c1","label_unlocked_at":"2026-08-10T01:07:54.554289Z","model_id":"M0","read_ordinal":361,"release_id":"P3-R05-fbd3c64-20260810-I01","run_id":"P3-R05-fbd3c64-20260810-I01-W08","schema_version":"3.0.0","target_issue":"2025129"}
