{"artifact_type":"phase3_guarded_label_unlock_receipt","attempt_id":"dlt-2025136-M0-attempt-01","experiment_id":"dlt-2025136-M0","forecast_path":"runs/forecasts/dlt/2025136/M0.json","forecast_sha256":"fc5ce4dbd9aa1baf0faa9bf60103bdf28da241d75dfde3ad8eafaec007941bcd","game":"dlt","guard_validation":{"forecast_current_hash_matches_lock":true,"forecast_persisted":true,"label_read_after_all_guards":true,"latest_ledger_state_is_matching_lock":true,"release_experiment_attempt_target_model_match":true},"label_sha256":"15e3bae6d7c47fc95bf285977402595c8b7f64595913723bfd5cb4e8a11edef9","label_store_identity":"phase3-label-store-v1:f2e34a88fbd43a378d7fb6255d39deee1354216b918934f355a06ef986be60c1","label_unlocked_at":"2026-08-10T01:07:19.671013Z","model_id":"M0","read_ordinal":81,"release_id":"P3-R05-fbd3c64-20260810-I01","run_id":"P3-R05-fbd3c64-20260810-I01-W08","schema_version":"3.0.0","target_issue":"2025136"}
