{"artifact_type":"phase3_guarded_label_unlock_receipt","attempt_id":"ssq-2026020-M0-attempt-01","experiment_id":"ssq-2026020-M0","forecast_path":"runs/forecasts/ssq/2026020/M0.json","forecast_sha256":"d75aedcfe898da12d371763afb92eed6d2984841b3744223a0d6b2731ba65db5","game":"ssq","guard_validation":{"forecast_current_hash_matches_lock":true,"forecast_persisted":true,"label_read_after_all_guards":true,"latest_ledger_state_is_matching_lock":true,"release_experiment_attempt_target_model_match":true},"label_sha256":"c97273094caf82bc54e33ed0446cd0173b93228fd968dead83541f66ee1a741e","label_store_identity":"phase3-label-store-v1:f2e34a88fbd43a378d7fb6255d39deee1354216b918934f355a06ef986be60c1","label_unlocked_at":"2026-08-10T01:53:31.073581Z","model_id":"M0","read_ordinal":445,"release_id":"P3-R06-7fbd226-20260810-I01","run_id":"P3-R06-7fbd226-20260810-I01-W08","schema_version":"3.0.0","target_issue":"2026020"}
