{"artifact_type":"phase3_guarded_label_unlock_receipt","attempt_id":"dlt-2026003-M1-attempt-01","experiment_id":"dlt-2026003-M1","forecast_path":"runs/forecasts/dlt/2026003/M1.json","forecast_sha256":"35730510ba2ba09745997eb8c0c83f3ae6f3a813d3f6eef6cb3228ac986c0a47","game":"dlt","guard_validation":{"forecast_current_hash_matches_lock":true,"forecast_persisted":true,"label_read_after_all_guards":true,"latest_ledger_state_is_matching_lock":true,"release_experiment_attempt_target_model_match":true},"label_sha256":"ca69524e952d9ee031682f4a6e7feb4f83764a4f7dad531450476d541ea53063","label_store_identity":"phase3-label-store-v1:f2e34a88fbd43a378d7fb6255d39deee1354216b918934f355a06ef986be60c1","label_unlocked_at":"2026-08-10T01:52:48.087898Z","model_id":"M1","read_ordinal":116,"release_id":"P3-R06-7fbd226-20260810-I01","run_id":"P3-R06-7fbd226-20260810-I01-W08","schema_version":"3.0.0","target_issue":"2026003"}
