{"artifact_type":"phase3_guarded_label_unlock_receipt","attempt_id":"dlt-2026054-M1-attempt-01","experiment_id":"dlt-2026054-M1","forecast_path":"runs/forecasts/dlt/2026054/M1.json","forecast_sha256":"26a2d2de65f92a5442d17916da46fd278c86e73684fca6d3f7087f137b840fbe","game":"dlt","guard_validation":{"forecast_current_hash_matches_lock":true,"forecast_persisted":true,"label_read_after_all_guards":true,"latest_ledger_state_is_matching_lock":true,"release_experiment_attempt_target_model_match":true},"label_sha256":"da341c691fb93e7140652c83ca24551bdbe88d6cc1b990abe528353b16c0bb76","label_store_identity":"phase3-label-store-v1:f2e34a88fbd43a378d7fb6255d39deee1354216b918934f355a06ef986be60c1","label_unlocked_at":"2026-08-09T06:00:30.517210Z","model_id":"M1","read_ordinal":242,"release_id":"P3-R04-33d2810-20260809-I01","run_id":"P3-R04-33d2810-20260809-I01-W08","schema_version":"3.0.0","target_issue":"2026054"}
