{"artifact_type":"phase3_guarded_label_unlock_receipt","attempt_id":"dlt-2025102-M1-attempt-01","experiment_id":"dlt-2025102-M1","forecast_path":"runs/forecasts/dlt/2025102/M1.json","forecast_sha256":"5bbaff320ebbc0f4848f7974dcc247b9100596b9746fe4f748eecdc96104af82","game":"dlt","guard_validation":{"forecast_current_hash_matches_lock":true,"forecast_persisted":true,"label_read_after_all_guards":true,"latest_ledger_state_is_matching_lock":true,"release_experiment_attempt_target_model_match":true},"label_sha256":"002265ccb5efc4dff5e15029f5b5a99e0c36f9b428aa120a006f3e5770194e99","label_store_identity":"phase3-label-store-v1:f2e34a88fbd43a378d7fb6255d39deee1354216b918934f355a06ef986be60c1","label_unlocked_at":"2026-08-10T02:40:30.974583Z","model_id":"M1","read_ordinal":14,"release_id":"P3-R07-2c0fa97-20260810-I01","run_id":"P3-R07-2c0fa97-20260810-I01-W08","schema_version":"3.0.0","target_issue":"2025102"}
